{
  "$schema": "../schema/CanSM.schema.json",
  "module": "CanSM",
  "channelCount": {
    "value": 1,
    "doc": [
      "管理ネットワーク（チャネル）数"
    ]
  },
  "busOffRecoveryL1Ms": {
    "value": 200,
    "doc": [
      "Bus-Off 回復待機時間 L1 [ms]（CanSMBorTimeL1 相当）",
      "AUTOSAR T_REC: バスオフ後、コントローラを再起動するまでの待ち時間。",
      "実車では 100〜200 ms が一般的。CANSM_BUSOFF_L1_TO_L2_COUNT 回まではこの",
      "短い周期でリトライする（SWS_CanSM_00514）。"
    ]
  },
  "busOffRecoveryL2Ms": {
    "value": 5000,
    "doc": [
      "Bus-Off 回復待機時間 L2 [ms]（CanSMBorTimeL2 相当）",
      "CANSM_BUSOFF_L1_TO_L2_COUNT 回のリトライを超えても回復しない場合、",
      "この長い周期へ切り替えて無期限にリトライを継続する（SWS_CanSM_00515）。",
      "「諦めて二度と復帰しない」状態は AUTOSAR 仕様に存在しないため、",
      "L1/L2 いずれの場合も回復試行そのものは打ち切らない。"
    ]
  },
  "busOffL1ToL2Count": {
    "value": 3,
    "doc": [
      "Bus-Off 回復試行回数の L1→L2 切替閾値（CanSMBorCounterL1ToL2 相当）",
      "この回数を超えて回復しない場合、一時的なバス障害ではなく持続的な",
      "Bus-Off と判断し、DemConf_DemEventParameter_CAN_BUSOFF (DTC 0x000108) を Dem へ FAILED",
      "報告した上で、リトライ周期を L2 へ切り替えて継続する（回復自体は続く）。",
      "Dem 側は DEM_DEBOUNCE_LIMIT_CAN_BUSOFF=1（この報告は既に十分なリトライを",
      "経た後の確定情報のため、Dem では重ねてデバウンスしない）。"
    ]
  },
  "borTxConfirmationPolling": {
    "value": 1,
    "doc": [
      "Bus-Off 回復の確定条件（G_BUS_OFF_PASSIVE）に TX 確認のポーリングを使うか（CanSMBorTxConfirmationPolling 相当、",
      "1=使う、0=使わない）。1 なら、再起動後に CanIf_GetTxConfirmationState() が CANIF_TX_RX_NOTIFICATION",
      "（再起動後に TX 確認が 1 回でもあった）を返した時点で回復が確定する（SWS_CanSM_00497）。",
      "0 なら（SILENT_COM に戻った場合も）、再起動から CANSM_BOR_TIME_TX_ENSURED_MS が経過した時点で確定する（SWS_CanSM_00496）。",
      "確定すると、Dem へ PASSED を報告し、回復試行回数を 0 に戻す（SWS_CanSM_00498）。"
    ]
  },
  "borTimeTxEnsuredMs": {
    "value": 1000,
    "doc": [
      "Bus-Off 回復の確定までの待ち時間 [ms]（CanSMBorTimeTxEnsured 相当）。",
      "CANSM_BOR_TX_CONFIRMATION_POLLING が 0 のとき（SWS_CanSM_00496）と、SILENT_COM に戻った場合（TX を抑制",
      "していて TX 確認が得られないため）に使う。この時間の間に再度 Bus-Off が起きなければ、回復が確定したとみなす。"
    ]
  },
  "wakeupValidationMs": {
    "value": 2000,
    "doc": [
      "ウェイクアップ検証タイムアウト [ms]（AUTOSAR EcuM Wakeup Validation",
      "Protocol 相当）。ボランタリスリープ中に MCP2515 の WAKIF が立ってから、",
      "この時間内に有効な CAN フレームを 1 つも受信できなければ、電気的ノイズ等",
      "による誤ウェイクアップとみなして再びスリープへ戻す。"
    ]
  }
}
